{
  "fixture_only": true,
  "contract_version": "v1",
  "catalog_version": "fixture-v1",
  "resources": [
    {
      "resource_id": "fixture-linear-algebra-reviewed",
      "title": "合成矩阵概念演示",
      "bvid": "BV1FIXTURE01",
      "url": "https://www.bilibili.com/video/BV1FIXTURE01",
      "course_id": "linear_algebra",
      "knowledge_point_id": "synthetic-matrix",
      "knowledge_point": "合成矩阵",
      "aliases": ["synthetic matrix"],
      "keywords": ["合成矩阵", "秩"],
      "review_status": "reviewed"
    },
    {
      "resource_id": "fixture-linear-algebra-pending",
      "title": "合成待审视频",
      "bvid": "BV1FIXTURE02",
      "url": "https://www.bilibili.com/video/BV1FIXTURE02",
      "course_id": "linear_algebra",
      "knowledge_point_id": "synthetic-pending",
      "knowledge_point": "合成待审主题",
      "aliases": [],
      "keywords": ["合成待审"],
      "review_status": "pending"
    },
    {
      "resource_id": "fixture-linear-algebra-rejected",
      "title": "合成已拒绝视频",
      "bvid": "BV1FIXTURE03",
      "url": "https://www.bilibili.com/video/BV1FIXTURE03",
      "course_id": "linear_algebra",
      "knowledge_point_id": "synthetic-rejected",
      "knowledge_point": "合成已拒绝主题",
      "aliases": [],
      "keywords": ["合成拒绝"],
      "review_status": "rejected"
    },
    {
      "resource_id": "fixture-linear-algebra-unavailable",
      "title": "合成已失效视频",
      "bvid": "BV1FIXTURE04",
      "url": "https://www.bilibili.com/video/BV1FIXTURE04",
      "course_id": "linear_algebra",
      "knowledge_point_id": "synthetic-unavailable",
      "knowledge_point": "合成已失效主题",
      "aliases": [],
      "keywords": ["合成失效"],
      "review_status": "unavailable"
    }
  ]
}
